{
  "$schema": "https://json-schema.org/draft/2020-12/schema",
  "$id": "morphocore:theme-manifest:2",
  "title": "Theme Manifest v2",
  "type": "object",
  "required": ["schemaVersion", "id", "displayName", "colors", "scene"],
  "properties": {
    "schemaVersion": { "type": "integer", "const": 1 },
    "id":            { "type": "string", "pattern": "^[a-z][a-z0-9_]*$" },
    "displayName":   { "type": "string", "minLength": 1 },
    "description":   { "type": "string" },
    "isDefault":     { "type": "boolean" },
    "colors": {
      "type": "object",
      "required": ["primary", "onPrimary", "background", "onBackground"],
      "properties": {
        "primary":          { "type": "string", "pattern": "^#[0-9A-Fa-f]{6}$" },
        "onPrimary":        { "type": "string", "pattern": "^#[0-9A-Fa-f]{6}$" },
        "secondary":        { "type": "string", "pattern": "^#[0-9A-Fa-f]{6}$" },
        "onSecondary":      { "type": "string", "pattern": "^#[0-9A-Fa-f]{6}$" },
        "background":       { "type": "string", "pattern": "^#[0-9A-Fa-f]{6}$" },
        "onBackground":     { "type": "string", "pattern": "^#[0-9A-Fa-f]{6}$" },
        "surface":          { "type": "string", "pattern": "^#[0-9A-Fa-f]{6}$" },
        "onSurface":        { "type": "string", "pattern": "^#[0-9A-Fa-f]{6}$" },
        "surfaceVariant":   { "type": "string", "pattern": "^#[0-9A-Fa-f]{6}$" },
        "onSurfaceVariant": { "type": "string", "pattern": "^#[0-9A-Fa-f]{6}$" },
        "outline":          { "type": "string", "pattern": "^#[0-9A-Fa-f]{6}$" },
        "semantic":         { "type": "object", "additionalProperties": { "type": "string", "pattern": "^#[0-9A-Fa-f]{6}$" } }
      }
    },
    "typography": {
      "type": "object",
      "properties": {
        "fontFamily": {
          "type": "object",
          "properties": {
            "display": { "type": ["string", "null"] },
            "body":    { "type": ["string", "null"] },
            "label":   { "type": ["string", "null"] }
          }
        },
        "scale": {
          "type": "object",
          "additionalProperties": {
            "type": "object",
            "required": ["size", "weight", "lineHeight"],
            "properties": {
              "size":       { "type": "integer" },
              "weight":     { "type": "integer" },
              "lineHeight": { "type": "integer" }
            }
          }
        }
      }
    },
    "shapes": {
      "type": "object",
      "properties": {
        "small":  { "type": "number" },
        "medium": { "type": "number" },
        "large":  { "type": "number" }
      }
    },
    "motion": {
      "type": "object",
      "properties": {
        "durationShort":   { "type": "integer" },
        "durationMedium":  { "type": "integer" },
        "durationLong":    { "type": "integer" },
        "easingStandard":  { "type": "string" }
      }
    },
    "scene": {
      "type": "object",
      "required": ["iblEnvironmentPath", "directLight"],
      "properties": {
        "skyboxPath":         { "type": ["string", "null"] },
        "iblEnvironmentPath": { "type": "string" },
        "iblIntensity":       { "type": "number" },
        "directLight": {
          "type": "object",
          "required": ["colorHex", "intensityLux", "azimuthDegrees", "elevationDegrees"],
          "properties": {
            "colorHex":         { "type": "string", "pattern": "^#[0-9A-Fa-f]{6}$" },
            "intensityLux":     { "type": "number" },
            "azimuthDegrees":   { "type": "number" },
            "elevationDegrees": { "type": "number" }
          }
        },
        "ambientIntensity": { "type": "number" },
        "groundPlane": {
          "type": "object",
          "properties": {
            "enabled":  { "type": "boolean" },
            "colorHex": { "type": "string", "pattern": "^#[0-9A-Fa-f]{6}$" },
            "opacity":  { "type": "number" }
          }
        },
        "postProcessing": {
          "type": "object",
          "properties": {
            "bloomIntensity":     { "type": "number" },
            "vignetteIntensity":  { "type": "number" },
            "toneMapping":        { "type": "string", "enum": ["ACES", "LINEAR", "FILMIC"] }
          }
        }
      }
    }
  }
}
