{
  "schemaVersion": 1,
  "id": "dojo",
  "displayName": "Dojo",
  "description": "Warm woods, paper textures, soft warm lighting.",
  "isDefault": false,
  "colors": {
    "primary": "#8B5A2B",
    "onPrimary": "#FFFFFF",
    "secondary": "#C9A36A",
    "onSecondary": "#1A0F00",
    "background": "#F5EFE3",
    "onBackground": "#1A0F00",
    "surface": "#FAF6EC",
    "onSurface": "#1A0F00",
    "surfaceVariant": "#E8DFCC",
    "onSurfaceVariant": "#3D2E1A",
    "outline": "#8C7B5A",
    "semantic": {
      "discipline.karate": "#A8412A",
      "discipline.kungfu": "#B8862A",
      "discipline.yoga": "#7A8C5A",
      "discipline.gym": "#5A6B7A",
      "discipline.calisthenics": "#8A6A4A",
      "difficulty.easy": "#7A8C5A",
      "difficulty.medium": "#C9A36A",
      "difficulty.hard": "#A8412A"
    }
  },
  "typography": {
    "fontFamily": { "display": "fonts/NotoSerifJP-Bold.ttf", "body": "fonts/NotoSerifJP-Regular.ttf", "label": "fonts/NotoSansJP-Medium.ttf" },
    "scale": {
      "displayLarge":  { "size": 57, "weight": 700, "lineHeight": 64 },
      "headlineLarge": { "size": 32, "weight": 700, "lineHeight": 40 },
      "titleLarge":    { "size": 22, "weight": 600, "lineHeight": 28 },
      "bodyLarge":     { "size": 16, "weight": 400, "lineHeight": 24 },
      "labelLarge":    { "size": 14, "weight": 500, "lineHeight": 20 }
    }
  },
  "shapes": { "small": 4, "medium": 8, "large": 16 },
  "motion": { "durationShort": 150, "durationMedium": 250, "durationLong": 400, "easingStandard": "cubicBezier(0.2, 0.0, 0.0, 1.0)" },
  "scene": {
    "skyboxPath": "environments/dojo_skybox.ktx2",
    "iblEnvironmentPath": "environments/dojo_ibl.ktx2",
    "iblIntensity": 1.0,
    "directLight": { "colorHex": "#FFE8C2", "intensityLux": 80000.0, "azimuthDegrees": 45.0, "elevationDegrees": -35.0 },
    "ambientIntensity": 0.3,
    "groundPlane": { "enabled": true, "colorHex": "#3D2E1A", "opacity": 0.4 },
    "postProcessing": { "bloomIntensity": 0.1, "vignetteIntensity": 0.15, "toneMapping": "ACES" }
  }
}
