{
  "schemaVersion": 1,
  "id": "iron",
  "displayName": "Iron",
  "description": "Dark charcoal surfaces, industrial red accents, hard rim lighting.",
  "isDefault": false,
  "colors": {
    "primary": "#CC2200", "onPrimary": "#FFFFFF",
    "secondary": "#8A9BAA", "onSecondary": "#0A0F14",
    "background": "#0D0F11", "onBackground": "#D8DEE4",
    "surface": "#1A1D20", "onSurface": "#D8DEE4",
    "surfaceVariant": "#2A2E33", "onSurfaceVariant": "#9BAAB8",
    "outline": "#4A5560",
    "semantic": {
      "discipline.karate": "#CC2200", "discipline.kungfu": "#CC6600",
      "discipline.yoga": "#66AA88", "discipline.gym": "#CC2200",
      "discipline.calisthenics": "#8888CC",
      "difficulty.easy": "#66AA88", "difficulty.medium": "#CC8800", "difficulty.hard": "#CC2200"
    }
  },
  "typography": {
    "fontFamily": { "display": null, "body": null, "label": null },
    "scale": {
      "displayLarge":  { "size": 57, "weight": 800, "lineHeight": 64 },
      "headlineLarge": { "size": 32, "weight": 800, "lineHeight": 40 },
      "titleLarge":    { "size": 22, "weight": 700, "lineHeight": 28 },
      "bodyLarge":     { "size": 16, "weight": 400, "lineHeight": 24 },
      "labelLarge":    { "size": 14, "weight": 600, "lineHeight": 20 }
    }
  },
  "shapes": { "small": 2, "medium": 4, "large": 8 },
  "motion": { "durationShort": 100, "durationMedium": 200, "durationLong": 300, "easingStandard": "cubicBezier(0.2, 0.0, 0.0, 1.0)" },
  "scene": {
    "skyboxPath": null,
    "iblEnvironmentPath": "environments/iron_ibl.ktx2",
    "iblIntensity": 1.2,
    "directLight": { "colorHex": "#D0E8FF", "intensityLux": 120000.0, "azimuthDegrees": -30.0, "elevationDegrees": -20.0 },
    "ambientIntensity": 0.1,
    "groundPlane": { "enabled": true, "colorHex": "#0A0C0E", "opacity": 0.6 },
    "postProcessing": { "bloomIntensity": 0.05, "vignetteIntensity": 0.3, "toneMapping": "ACES" }
  }
}
